{
  "$schema": "https://json-schema.org/draft/2020-12/schema",
  "$id": "https://mova.dev/mova-agent-api/schemas/connector_execution_config.schema.json",
  "title": "MOVA Agent API V0 Connector Execution Config",
  "description": "Provider-agnostic config for connector execution adapter selection and guard rules.",
  "type": "object",
  "additionalProperties": false,
  "required": [
    "adapter_kind",
    "allowed_connectors",
    "allowed_side_effect_intents",
    "offline_stub_rules",
    "allowed_webhook_urls",
    "endpoint_registry",
    "provider_connector_registry",
    "timeout_ms",
    "max_retries"
  ],
  "properties": {
    "adapter_kind": {
      "type": "string",
      "enum": [
        "deterministic_local",
        "offline_stub",
        "webhook_site",
        "http_generic"
      ]
    },
    "allowed_connectors": {
      "type": "array",
      "items": {
        "type": "string",
        "minLength": 1
      }
    },
    "allowed_side_effect_intents": {
      "type": "array",
      "items": {
        "type": "string",
        "enum": [
          "none",
          "local_only",
          "external_network",
          "destructive"
        ]
      }
    },
    "offline_stub_rules": {
      "type": "array",
      "items": {
        "type": "object",
        "additionalProperties": false,
        "required": [
          "connector_id",
          "call_status",
          "guard_reason"
        ],
        "properties": {
          "connector_id": {
            "type": "string",
            "minLength": 1
          },
          "call_status": {
            "type": "string",
            "enum": [
              "pending",
              "allowed",
              "blocked",
              "failed",
              "completed"
            ]
          },
          "guard_reason": {
            "type": "string",
            "minLength": 1
          }
        }
      }
    },
    "allowed_webhook_urls": {
      "type": "array",
      "items": {
        "type": "string",
        "format": "uri"
      }
    },
    "endpoint_registry": {
      "type": "array",
      "items": {
        "type": "object",
        "additionalProperties": false,
        "required": [
          "endpoint_ref",
          "url",
          "allowed_methods",
          "allowed_side_effect_intents",
          "required_scopes",
          "timeout_ms",
          "max_retries",
          "evidence_policy",
          "enabled"
        ],
        "properties": {
          "endpoint_ref": {
            "type": "string",
            "minLength": 1
          },
          "url": {
            "type": "string",
            "format": "uri"
          },
          "allowed_methods": {
            "type": "array",
            "items": {
              "type": "string",
              "enum": [
                "GET",
                "POST"
              ]
            },
            "minItems": 1
          },
          "allowed_side_effect_intents": {
            "type": "array",
            "items": {
              "type": "string",
              "enum": [
                "none",
                "local_only",
                "external_network",
                "destructive"
              ]
            },
            "minItems": 1
          },
          "required_scopes": {
            "type": "array",
            "items": {
              "type": "string",
              "minLength": 1
            }
          },
          "timeout_ms": {
            "type": "integer",
            "minimum": 1,
            "maximum": 120000
          },
          "max_retries": {
            "type": "integer",
            "minimum": 0,
            "maximum": 3
          },
          "evidence_policy": {
            "type": "string",
            "enum": [
              "summary_only",
              "headers_redacted",
              "body_redacted",
              "status_only"
            ]
          },
          "enabled": {
            "type": "boolean"
          }
        }
      }
    },
    "provider_connector_registry": {
      "type": "array",
      "items": {
        "type": "object",
        "additionalProperties": false,
        "required": [
          "connector_ref",
          "provider",
          "operation",
          "required_scopes",
          "allowed_operations",
          "secret_refs",
          "evidence_policy",
          "enabled"
        ],
        "properties": {
          "connector_ref": {
            "type": "string",
            "minLength": 1
          },
          "provider": {
            "type": "string",
            "minLength": 1
          },
          "operation": {
            "type": "string",
            "minLength": 1
          },
          "required_scopes": {
            "type": "array",
            "items": {
              "type": "string",
              "minLength": 1
            },
            "minItems": 1
          },
          "allowed_operations": {
            "type": "array",
            "items": {
              "type": "string",
              "minLength": 1
            },
            "minItems": 1
          },
          "secret_refs": {
            "type": "object",
            "additionalProperties": {
              "type": "string",
              "minLength": 1
            },
            "required": [
              "bot_token",
              "chat_id"
            ],
            "properties": {
              "bot_token": {
                "type": "string",
                "minLength": 1
              },
              "chat_id": {
                "type": "string",
                "minLength": 1
              }
            }
          },
          "evidence_policy": {
            "type": "string",
            "enum": [
              "summary_only",
              "headers_redacted",
              "body_redacted",
              "status_only"
            ]
          },
          "enabled": {
            "type": "boolean"
          }
        }
      }
    },
    "timeout_ms": {
      "type": "integer",
      "minimum": 1,
      "maximum": 120000
    },
    "max_retries": {
      "type": "integer",
      "minimum": 0,
      "maximum": 3
    }
  }
}
