{
  "adapter_kind": "deterministic_local",
  "allowed_connectors": [
    "connector.docs.v1"
  ],
  "allowed_side_effect_intents": [
    "none",
    "local_only"
  ],
  "offline_stub_rules": [],
  "allowed_webhook_urls": [],
  "endpoint_registry": [
    {
      "endpoint_ref": "webhook_site_test",
      "url": "https://webhook.site/91c77fd2-f847-43ed-9c18-79b5aebc8b95",
      "allowed_methods": [
        "POST"
      ],
      "allowed_side_effect_intents": [
        "external_network"
      ],
      "required_scopes": [
        "actions.run"
      ],
      "timeout_ms": 10000,
      "max_retries": 0,
      "evidence_policy": "summary_only",
      "enabled": true
    },
    {
      "endpoint_ref": "webhook_site_contract_run_test",
      "url": "https://webhook.site/91c77fd2-f847-43ed-9c18-79b5aebc8b95",
      "allowed_methods": [
        "POST"
      ],
      "allowed_side_effect_intents": [
        "external_network"
      ],
      "required_scopes": [
        "contracts.run"
      ],
      "timeout_ms": 10000,
      "max_retries": 0,
      "evidence_policy": "summary_only",
      "enabled": true
    }
  ],
  "provider_connector_registry": [
    {
      "connector_ref": "telegram.fixture_primary_channel",
      "provider": "telegram",
      "operation": "send_message",
      "required_scopes": [
        "contracts.run"
      ],
      "allowed_operations": [
        "op_provider_send_message"
      ],
      "secret_refs": {
        "bot_token": "TELEGRAM_BOT_TOKEN",
        "chat_id": "TELEGRAM_OWNER_REPORT_CHAT_ID"
      },
      "evidence_policy": "summary_only",
      "enabled": true
    }
  ],
  "timeout_ms": 10000,
  "max_retries": 0
}
